{
  "protocol": "2.5",
  "course": {
    "id": "7f72e600-3425-490c-b530-0179826cb206",
    "revision": 12,
    "title": "Prompt engineering basics",
    "summary": "How to write prompts that get useful answers.",
    "learning_objectives": [
      "Write a clear prompt",
      "Iterate on a prompt"
    ],
    "audience": "Professionals new to AI tools",
    "cover_image_url": "https://cdn.example.com/editor-assets/9f86d081884c7d659a2feaa0c55ad015a3bf4f1b2b0b822cd15d6c15b0f00a08",
    "length_hours": 2,
    "lesson_size": "short",
    "pricing": {
      "type": "free"
    },
    "organization": null,
    "department": null,
    "access_mode": "individual",
    "placement_size": null,
    "metadata": {
      "domains": [
        "Generic"
      ],
      "future_goals": [
        "AI Engineer"
      ],
      "departments": [
        "Generic"
      ],
      "require_future_goal": false
    }
  },
  "review": {
    "status": "in_review",
    "note": null,
    "changes": []
  },
  "levels": [
    {
      "key": "associate",
      "title": "Associate",
      "modules": [
        {
          "id": "0d5e4f8a-3b1c-4c2d-9e6f-7a8b9c0d1e2f",
          "title": "Getting started",
          "summary": "",
          "lessons": [
            {
              "id": "c107dca3-7b73-4411-8e4c-bc1f7f2371b0",
              "title": "What a prompt is",
              "content": {
                "version": 1,
                "format": "blocks",
                "sections": [
                  {
                    "id": "a1b2c3d4-e5f6-4a7b-8c9d-0e1f2a3b4c5d",
                    "title": "The idea",
                    "required_to_advance": true,
                    "blocks": [
                      {
                        "id": "b1c2d3e4-f5a6-4b7c-8d9e-0f1a2b3c4d5e",
                        "type": "rich_text",
                        "personalized": false,
                        "data": {
                          "markdown": "A **prompt** is…"
                        }
                      },
                      {
                        "id": "c1d2e3f4-a5b6-4c7d-8e9f-0a1b2c3d4e5f",
                        "type": "mcq",
                        "personalized": false,
                        "data": {
                          "question": "What is a prompt?",
                          "options": [
                            "An instruction",
                            "A model"
                          ],
                          "correct_index": 0
                        }
                      }
                    ]
                  }
                ]
              }
            },
            {
              "id": "d1e2f3a4-b5c6-4d7e-8f9a-0b1c2d3e4f5a",
              "title": "Not written yet",
              "content": null
            }
          ]
        }
      ],
      "placement": [
        {
          "id": "e1f2a3b4-c5d6-4e7f-8a9b-0c1d2e3f4a5b",
          "question": "Which of these makes a prompt clearer?",
          "options": [
            "Saying what the answer is for",
            "Making it shorter",
            "Using capital letters"
          ],
          "correct_index": 0,
          "difficulty": "easy",
          "explanation": "Context about the goal lets the model choose what matters."
        }
      ]
    },
    {
      "key": "intermediate",
      "title": "Intermediate",
      "modules": [],
      "placement": []
    },
    {
      "key": "advanced",
      "title": "Advanced",
      "modules": [],
      "placement": []
    }
  ],
  "actor": {
    "id": "3f0c2b9e-8a41-4d7e-9c55-2b6f1e0a7d13",
    "name": "Sara Khan",
    "email": "sara@example.com"
  },
  "sent_at": "2026-10-05T09:00:00.000Z"
}
